<!ELEMENT gestuary (entry*)>

<!ELEMENT entry (verbatim,form)>
<!ELEMENT verbatim (#PCDATA)>
<!ELEMENT form (head)>
<!ELEMENT head (movement+)>
<!ELEMENT movement (timing,point+)>
<!ELEMENT timing EMPTY>
<!ELEMENT point EMPTY>

<!ATTLIST entry id CDATA #REQUIRED>
<!ATTLIST movement trajectory (linear|curved|circular) "linear">
<!ATTLIST movement phase (all_length|preparation|stroke|hold|retraction) #REQUIRED>
<!ATTLIST timing min CDATA "0">
<!ATTLIST timing max CDATA "1">
<!ATTLIST timing duration CDATA "0.3">
<!ATTLIST timing fixed (0|1) "0">
<!ATTLIST point x CDATA "0">
<!ATTLIST point y CDATA "0">
<!ATTLIST point z CDATA "0">
<!ATTLIST point spatial_fixed (0|1) "0">
<!ATTLIST point scaling CDATA "1">